{
  "estudiante_id": "demo-001",
  "origen": "simulado",
  "estilos_aprendizaje": {
    "modelo": "felder_silverman",
    "puntajes": {
      "activo_reflexivo": 1.7,
      "sensorial_intuitivo": 4.6,
      "visual_verbal": 1.7,
      "secuencial_global": 3.2
    },
    "preferencias": ["activo", "intuitivo", "visual"],
    "descripcion_para_prompt": "Aprende mejor experimentando y con ejemplos concretos; le funcionan los esquemas visuales, diagramas y pasos claros. Evitar teoria pasiva y textos densos sin apoyo grafico."
  },
  "personalidad": {
    "rasgos": {
      "introversion_extraversion": 4.1,
      "autonomia": 2.1,
      "metodicidad": 4.6,
      "apertura": 1.9
    },
    "resumen_conductual": "Colabora bien en foros y debates; necesita secuencia y cronograma claros; conecta con ejemplos concretos y aplicacion practica.",
    "preferencias_trabajo": ["colaborativo", "foros y debates", "secuencia definida", "cronograma", "ejemplos concretos", "aplicacion practica inmediata"]
  },
  "chaside": {
    "areas": {
      "C": 2.1,
      "H": 3.0,
      "A": 2.7,
      "S": 1.9,
      "I": 3.3,
      "D": 1.3,
      "E": 2.4
    },
    "areas_dominantes": ["I", "H"],
    "descripcion_para_analogias": "Conectar la materia con sistemas, diseno logico y comunicacion clara; areas dominantes: Investigador (I) y Humanistico (H)."
  }
}
